{
  "contract": "kolosseum:evidence_envelope@1",
  "engine": {
    "version": "0.1.23",
    "node": "25.9.0"
  },
  "inputs": {
    "request_sha256": "0000000000000000000000000000000000000000000000000000000000000000",
    "constraints_sha256": "0000000000000000000000000000000000000000000000000000000000000000",
    "registry_bundle_sha256": "0000000000000000000000000000000000000000000000000000000000000000",
    "schema_sha256s": [
      {
        "path": "ci/schemas/phase1.input.schema.v1.0.0.json",
        "sha256": "0000000000000000000000000000000000000000000000000000000000000000"
      }
    ]
  },
  "artifacts": {
    "phase_outputs": [
      {
        "phase": 1,
        "name": "phase1_envelope",
        "sha256": "0000000000000000000000000000000000000000000000000000000000000000"
      },
      {
        "phase": 3,
        "name": "phase3_constraints",
        "sha256": "0000000000000000000000000000000000000000000000000000000000000000"
      },
      {
        "phase": 4,
        "name": "phase4_program",
        "sha256": "0000000000000000000000000000000000000000000000000000000000000000"
      },
      {
        "phase": 6,
        "name": "phase6_session",
        "sha256": "0000000000000000000000000000000000000000000000000000000000000000"
      }
    ]
  },
  "validations": {
    "guards": [
      {
        "name": "registry_law_guard",
        "result": "pass"
      },
      {
        "name": "engine_contract_guard",
        "result": "pass"
      }
    ]
  }
}
